commit	status	description	eval_auc	holdout_auc
92e43e6	keep	baseline	0.7203	0.7155
e25ad0c	discard	add scheduled departure minute and cyclic features	0.7195	N/A
74791e4	discard	add origin-destination categorical feature	0.7071	N/A
e6cf329	keep	increase n_estimators from 30 to 100	0.7306	0.7271
edd60ad	keep	increase n_estimators from 100 to 200	0.7345	0.7311
40794f6	discard	increase n_estimators from 200 to 400	0.7325	N/A
56b0e18	keep	use learning_rate 0.05 with 400 trees	0.7354	0.7315
b93416e	discard	use learning_rate 0.025 with 800 trees	0.7349	N/A
35f9b34	discard	reduce max_depth from 6 to 4	0.7326	N/A
4533c8e	discard	set subsample to 0.8	0.7285	N/A
e9148ab	discard	set min_child_weight to 5	0.7346	N/A
ad5be21	discard	set min_child_weight to 2	0.7354	N/A
1d7cf8f	keep	set colsample_bytree to 0.8	0.7386	0.7350
e02eab6	keep	set colsample_bytree to 0.6	0.7423	0.7383
e326d39	keep	set colsample_bytree to 0.4	0.7424	0.7385
f3ca7c3	discard	set colsample_bytree to 0.3	0.7334	N/A
dea6053	discard	set colsample_bytree to 0.5	0.7423	N/A
4eb11a2	discard	reduce max_depth from 6 to 5 with colsample 0.4	0.7374	N/A
2f64036	keep	set gamma to 0.1	0.7425	0.7384
1c76f62	discard	set gamma to 0.5	0.7411	N/A
003959b	discard	add train-derived departure hour category	0.7406	N/A
96a3a26	discard	use colsample_bynode 0.4 instead of bytree	0.7411	N/A
023952f	discard	set max_cat_threshold to 32	0.7420	N/A
1e9b05a	discard	use learning_rate 0.04 with 500 trees	0.7421	N/A
1341b07	discard	set reg_lambda to 2	0.7422	N/A
18fbae2	crash	DART training timeout at 60 seconds	0.0000	N/A
035f389	discard	use two parallel trees over 200 rounds	0.7353	N/A
73e6681	discard	set reg_alpha to 0.1	0.7420	N/A
2c4edeb	keep	increase max_depth from 6 to 7	0.7458	0.7423
3b0d806	keep	increase max_depth from 7 to 8	0.7472	0.7435
97e3fcb	discard	use loss-guided tree growth with 256 leaves	0.7472	N/A
6816613	discard	increase max_depth from 8 to 9	0.7470	N/A
b348a08	keep	reduce depth-8 model from 400 to 300 rounds	0.7466	0.7424
20de88c	keep	increase depth-8 model from 300 to 350 rounds	0.7472	0.7433
659a243	keep	use learning rate 0.04 with 450 depth-8 rounds	0.7475	0.7438
0d8452c	discard	set max_cat_to_onehot to 13	0.7453	N/A
67392a8	discard	set scale_pos_weight to 2.0	0.7469	N/A
e163052	discard	increase histogram max_bin to 512	0.7474	N/A
460b1f1	discard	add cross-fitted smoothed route delay-rate feature	0.7440	N/A
f710efb	discard	add cross-fitted smoothed origin delay-rate feature	0.7453	N/A
6d3691a	discard	weight numeric features twice for column sampling	0.7434	N/A
be6fb10	keep	increase depth-8 tree feature fraction to 0.5	0.7486	0.7451
3298742	discard	increase depth-8 tree feature fraction to 0.6	0.7486	N/A
d7c7b84	discard	test depth-8 tree feature fraction 0.55	0.7486	N/A
fc5e4ac	keep	increase depth from 8 to 9 at feature fraction 0.5	0.7491	0.7462
b328d4d	keep	set min_child_weight to 2 in depth-nine model	0.7500	0.7464
f888d1d	discard	increase depth-nine min_child_weight to 3	0.7494	N/A
28e19b7	discard	increase depth-nine model to depth 10	0.7493	N/A
d81ccec	keep	reduce depth-nine model from 450 to 400 rounds	0.7500	0.7461
74c0a1f	keep	reduce regularized depth-nine model to 350 rounds	0.7500	0.7461
e8a966d	discard	set max_delta_step to 1	0.7496	N/A
5d55e95	keep	use 0.05 learning rate with 280 depth-nine rounds	0.7496	0.7461
7026164	discard	use 0.045 learning rate with 310 depth-nine rounds	0.7494	N/A
0d4f090	discard	increase compact 0.05 schedule from 280 to 320 rounds	0.7492	N/A
cec373c	keep	set reg_lambda to 2 in depth-nine model	0.7510	0.7463
f3cfbdd	keep	set reg_lambda to 3 in depth-nine model	0.7511	0.7467
a996d58	discard	increase reg_lambda to 4	0.7508	N/A
1a90f10	discard	set reg_lambda to 2.5	0.7504	N/A
0e31508	discard	lower gamma from 0.1 to 0.05	0.7505	N/A
59dfad7	keep	add reg_alpha 0.1 with depth-nine L2 regularization	0.7515	0.7471
118a7a6	keep	increase depth-nine reg_alpha to 0.2	0.7518	0.7469
ace666b	discard	increase depth-nine reg_alpha to 0.3	0.7515	N/A
a0656d9	discard	set depth-nine reg_alpha to 0.25	0.7510	N/A
e1cf167	keep	reduce L1-regularized depth-nine model to 325 rounds	0.7514	0.7462
d9fcb69	keep	reduce L1-regularized depth-nine model to 300 rounds	0.7514	0.7460
79a9d20	keep	reduce L1-regularized depth-nine model to 275 rounds	0.7510	0.7457
f73d748	discard	reduce regularized model depth from 9 to 8	0.7489	N/A
44eedad	discard	set min_child_weight to 1.5 with L1 and L2	0.7516	N/A
