commit	status	description	eval_auc	holdout_auc
92e43e6	keep	baseline	0.7203	0.7155
8aee124	keep	300 boosting rounds	0.7342	0.7315
a0254c0	discard	800 boosting rounds	0.7273	N/A
f3840b2	crash	day of year initial parse failed on c-prefixed dates	0.0000	N/A
d1363d0	keep	day of year numeric feature	0.7378	0.7346
da2bac6	keep	depth 4 at 300 rounds	0.7382	0.7350
899fd6e	discard	600 depth 4 trees	0.7377	N/A
83fddbc	keep	600 trees at learning rate 0.05	0.7390	0.7355
ae46c18	discard	origin-destination route category	0.7136	N/A
0a6a527	discard	categorical departure hour	0.7387	N/A
c227c93	discard	row subsampling 0.8	0.7295	N/A
adc94cb	keep	minimum child weight 10	0.7395	0.7360
8da8475	discard	departure time relative to origin median	0.7394	N/A
dc1a4f6	discard	categorical split threshold 16	0.7391	N/A
06bbfdd	discard	remove Distance feature	0.7390	N/A
027ceba	discard	distance to major 2005 holidays	0.7394	N/A
1aad504	discard	one-hot splits for small categories	0.7300	N/A
e58b6e2	discard	depth 3 at 600 rounds	0.7349	N/A
9999a36	discard	depth 5 tied best with more complexity	0.7395	N/A
96ceb81	discard	minimum child weight 25	0.7394	N/A
2e6e271	discard	512 histogram bins	0.7387	N/A
879b4c1	discard	128 histogram bins	0.7385	N/A
7e17247	discard	minute within scheduled departure hour	0.7389	N/A
2b118a3	keep	carrier-month interaction category	0.7403	0.7376
316e780	keep	carrier-weekday interaction category	0.7437	0.7390
cb7b54a	keep	month-weekday interaction category	0.7455	0.7403
7d978e7	keep	categorical day of year	0.7564	0.7510
31d885f	keep	remove redundant numeric day of year	0.7564	0.7510
db15909	keep	remove day-of-month predictor	0.7564	0.7510
5dc36a5	keep	remove standalone month predictor	0.7564	0.7510
32e7390	keep	remove standalone weekday predictor	0.7564	0.7510
56cdb69	keep	remove unused standalone carrier predictor	0.7564	0.7510
59a3cbf	keep	categorical split threshold 128	0.7569	0.7521
798ad3e	discard	categorical split threshold 256	0.7568	N/A
2ca035c	discard	carrier-hour interaction category	0.7555	N/A
3e9daa9	discard	1000 boosting rounds with rich features	0.7566	N/A
1a50d05	discard	origin-weekday interaction category	0.7460	N/A
c372251	discard	L2 regularization 10	0.7568	N/A
ced52b6	discard	lossguide trees with 16 leaves	0.7558	N/A
18b41b8	keep	approximate tree construction	0.7580	0.7531
14cbf1b	discard	depth 5 with approx trees	0.7571	N/A
b1aa9a4	discard	400 boosting rounds with approx	0.7564	N/A
b68016a	keep	equal soft vote of hist and approx	0.7586	0.7536
e80d173	discard	three-to-one approx-hist voting weights	0.7586	N/A
c2287b3	discard	seven-day date block category	0.7586	N/A
39dacf1	keep	remove month-weekday interaction	0.7586	0.7536
4f512be	discard	remove carrier-month interaction	0.7573	N/A
0f7abd9	keep	column sampling 0.8 per node	0.7588	0.7543
3227d04	keep	column sampling 0.8 per tree	0.7596	0.7545
75970a3	discard	column sampling 0.7 per tree	0.7594	N/A
1936422	discard	column sampling 0.9 per tree	0.7593	N/A
f57f614	discard	minimum split gain gamma 1	0.7580	N/A
6a83fef	keep	average two seeds of hist and approx	0.7600	0.7548
e40bb08	keep	remove hist members from two-seed ensemble	0.7599	0.7547
0971dce	discard	mixed approx seed 42 and hist seed 17	0.7594	N/A
cd293c0	keep	three-model ensemble with two approx seeds and hist seed 42	0.7600	0.7548
1268b2f	discard	minimum child weight 5 in three-model ensemble	0.7596	N/A
f45dcdf	keep	L1 leaf regularization alpha 1	0.7603	0.7548
34d5b22	keep	L1 leaf regularization alpha 3	0.7610	0.7551
7664ce1	discard	L1 leaf regularization alpha 8	0.7573	N/A
3fe9d81	discard	L1 leaf regularization alpha 5	0.7607	N/A
acda980	discard	remove hist member with L1 alpha 3	0.7605	N/A
231b6c1	discard	cyclical departure time sine and cosine	0.7611	N/A
a0876f5	keep	depth five with L1 regularization alpha 3	0.7630	0.7575
413282c	keep	depth six with L1 regularization alpha 3	0.7646	0.7586
5bc8b91	keep	depth seven with L1 regularization alpha 3	0.7651	0.7591
c318666	keep	depth eight with L1 regularization alpha 3	0.7652	0.7587
7271b31	keep	depth eight with L1 regularization alpha 5	0.7668	0.7609
7cd8d4b	discard	depth eight with L1 regularization alpha 8	0.7646	N/A
3a9784b	discard	400 rounds at depth eight alpha 5	0.7662	N/A
90441ca	discard	800 rounds at depth eight alpha 5	0.7668	N/A
36b7252	discard	remove histogram member at depth eight alpha 5	0.7666	N/A
0bbc04e	discard	remove Distance at depth eight alpha 5	0.7656	N/A
fad5697	keep	categorical split threshold 256 at depth eight alpha 5	0.7670	0.7611
