commit	status	description	eval_auc	holdout_auc
92e43e6	keep	baseline	0.7203	0.7155
1f23655	keep	300 trees, learning rate 0.05	0.7348	0.7306
bdf3a7d	keep	600 trees, learning rate 0.05	0.7359	0.7320
282ae7e	discard	max depth 8	0.7321	N/A
2f7b4dc	discard	subsample 0.8	0.7280	N/A
4dd691e	discard	minute of day and cyclic departure time features	0.7346	N/A
c1e35c0	discard	route median departure time residual	0.7355	N/A
2efbf99	discard	max_cat_to_onehot 32	0.7236	N/A
142be3f	keep	max_cat_threshold 32	0.7373	0.7343
7f62064	keep	max_cat_threshold 16	0.7409	0.7357
cbc12e8	keep	max_cat_threshold 8	0.7415	0.7368
50487c6	discard	max_cat_threshold 4	0.7371	N/A
99e4b1d	keep	min_child_weight 5	0.7431	0.7386
a0c57b5	keep	min_child_weight 10	0.7436	0.7387
ac677a6	keep	min_child_weight 20	0.7439	0.7384
602b949	keep	min_child_weight 40	0.7456	0.7402
9998dbc	discard	min_child_weight 80	0.7450	N/A
da96cdf	discard	gamma 1	0.7373	N/A
2b08bed	discard	gamma 0.1	0.7453	N/A
044dbc7	discard	reg_lambda 5	0.7453	N/A
bd6ccb9	keep	min_child_weight 60	0.7468	0.7416
eee859a	discard	min_child_weight 50	0.7453	N/A
90822ae	discard	min_child_weight 70	0.7459	N/A
341a649	discard	max_depth 5	0.7402	N/A
2b29a1f	keep	800 trees, min_child_weight 60	0.7489	0.7435
919fcc3	keep	1000 trees, min_child_weight 60	0.7496	0.7445
b4a1b99	keep	1200 trees, min_child_weight 60	0.7502	0.7453
100c89b	keep	1400 trees, min_child_weight 60	0.7504	0.7458
7b207ee	discard	1600 trees, min_child_weight 60	0.7503	N/A
ce38e68	keep	2300 trees, learning rate 0.03	0.7508	0.7455
1fa9e7e	discard	2600 trees, learning rate 0.03	0.7507	N/A
2f5bb54	discard	3450 trees, learning rate 0.02	0.7505	N/A
c6656a5	discard	2760 trees, learning rate 0.025	0.7500	N/A
0d79c54	discard	Origin-Dest native category	0.7499	N/A
86df5da	discard	4-hour departure time block category	0.7504	N/A
f327baa	discard	origin by departure block category	0.7500	N/A
7824878	keep	lossguide, max leaves 64	0.7524	0.7471
26bc48b	discard	lossguide, max leaves 128	0.7474	N/A
e06bcc7	keep	lossguide, max leaves 32	0.7531	0.7476
d0c8717	keep	lossguide, max leaves 48	0.7537	0.7483
c47499d	discard	lossguide, max leaves 56	0.7528	N/A
8d3a478	keep	lossguide, max leaves 40; tied rounded AUC with a smaller model	0.7537	0.7475
8b5fa9f	keep	lossguide, max leaves 44	0.7541	0.7487
61ef4cc	discard	lossguide, max leaves 42	0.7527	N/A
63bef7e	discard	lossguide, max leaves 46	0.7536	N/A
26f58b8	discard	lossguide, max leaves 43	0.7529	N/A
acae50a	discard	colsample_bytree 0.8	0.7530	N/A
7fdaa25	discard	colsample_bytree 0.9	0.7533	N/A
87c47e4	keep	min_child_weight 50 under lossguide, max leaves 44	0.7545	0.7491
f113683	discard	min_child_weight 55 under lossguide, max leaves 44	0.7540	N/A
8d8238e	discard	min_child_weight 45 under lossguide, max leaves 44	0.7543	N/A
5876c2f	discard	min_child_weight 48 under lossguide, max leaves 44	0.7543	N/A
6a14f23	discard	max_cat_threshold 16 under lossguide, max leaves 44	0.7477	N/A
2fc9ee6	discard	max_cat_to_onehot 8 under lossguide	0.7537	N/A
14cadb3	discard	max_cat_to_onehot 16 under lossguide	0.7531	N/A
523a3aa	discard	cross-fitted smoothed target rates for Origin, Dest, Carrier, Route	0.7522	N/A
1306688	discard	cross-fitted smoothed target rates for Origin, Dest, Carrier	0.7541	N/A
18ff1a9	discard	cross-fitted smoothed target rates for Origin, Dest	0.7544	N/A
c04916c	discard	cross-fitted smoothed Origin target rate	0.7545	N/A
4acab1e	discard	cross-fitted smoothed Dest target rate	0.7537	N/A
2c5ab63	discard	max_bin 512 under lossguide	0.7529	N/A
bd165ba	discard	max_bin 128 under lossguide	0.7542	N/A
d1aba92	discard	max_bin 192 under lossguide	0.7539	N/A
a3fa724	keep	reg_alpha 0.1 under lossguide	0.7546	0.7507
0270f00	keep	reg_alpha 0.5 under lossguide	0.7581	0.7540
aa1a768	keep	reg_alpha 1.0 under lossguide	0.7584	0.7542
d565873	discard	reg_alpha 2.0 under lossguide	0.7568	N/A
16a0058	discard	reg_alpha 1.5 under lossguide	0.7570	N/A
5a6da1e	keep	reg_alpha 0.75 under lossguide	0.7597	0.7550
467d4ee	discard	reg_alpha 0.8 under lossguide	0.7591	N/A
cfb4e7c	discard	reg_alpha 0.7 under lossguide	0.7596	N/A
0d00ae7	discard	reg_alpha 0.74 under lossguide	0.7584	N/A
